{
  "schemaVersion": "1.0",
  "channel": "beta",
  "appId": "studio.novel.local",
  "productName": "ShanHai",
  "version": "0.1.0",
  "artifactKinds": ["win-unpacked", "win-nsis"],
  "publishMode": "manual",
  "releaseNotesPath": "docs/releases/v0.1.0-beta.md",
  "signing": {
    "required": false,
    "policy": "unsigned-local-beta",
    "windowsCertificateEnv": ["CSC_LINK", "CSC_KEY_PASSWORD"],
    "notarization": "not-applicable-for-windows-beta"
  }
}
